[
  {
    "schema_version": 1,
    "case_id": "start-of-field",
    "description": "empty before-text: no space, recognizer casing kept",
    "before": "",
    "after": " world",
    "raw": "Hello",
    "verbatim": false,
    "expected_text": "Hello",
    "expected_changes": []
  },
  {
    "schema_version": 1,
    "case_id": "start-of-field-before-existing-punct",
    "description": "start of field with a comma after the cursor: no trailing change",
    "before": "",
    "after": ", actually",
    "raw": "Hello",
    "verbatim": false,
    "expected_text": "Hello",
    "expected_changes": []
  },
  {
    "schema_version": 1,
    "case_id": "hint-text-field-is-empty",
    "description": "a field showing only its placeholder is treated as empty: no space, casing kept",
    "before": "Search notes",
    "after": "",
    "showing_hint": true,
    "raw": "Hello",
    "verbatim": false,
    "expected_text": "Hello",
    "expected_changes": []
  },
  {
    "schema_version": 1,
    "case_id": "hint-text-field-mid-sentence-hint",
    "description": "hint text that looks mid-sentence still reads as an empty field",
    "before": "Type a message,",
    "after": "",
    "showing_hint": true,
    "raw": "Fox jumps",
    "verbatim": false,
    "expected_text": "Fox jumps",
    "expected_changes": []
  },
  {
    "schema_version": 1,
    "case_id": "mid-sentence-lowercase",
    "description": "letter before the cursor: leading space plus lowercase",
    "before": "The quick brown",
    "after": "",
    "raw": "Fox jumps",
    "verbatim": false,
    "expected_text": " fox jumps",
    "expected_changes": [
      { "kind": "leading_space", "detail": "previous character 'n' is not whitespace or an opening bracket/quote" },
      { "kind": "first_letter_case", "detail": "previous non-whitespace 'n' continues the sentence" }
    ]
  },
  {
    "schema_version": 1,
    "case_id": "mid-sentence-already-lowercase",
    "description": "letter before the cursor, dictated text already lowercase",
    "before": "The quick brown",
    "after": "",
    "raw": "fox jumps",
    "verbatim": false,
    "expected_text": " fox jumps",
    "expected_changes": [
      { "kind": "leading_space", "detail": "previous character 'n' is not whitespace or an opening bracket/quote" }
    ]
  },
  {
    "schema_version": 1,
    "case_id": "mid-sentence-later-capital-kept",
    "description": "the first cased character is already lowercase: later capitals are not touched",
    "before": "word ",
    "after": "",
    "raw": "hello. Next sentence",
    "verbatim": false,
    "expected_text": "hello. Next sentence",
    "expected_changes": []
  },
  {
    "schema_version": 1,
    "case_id": "after-period-keep-capital",
    "description": "sentence-ending punctuation keeps the capital",
    "before": "Done.",
    "after": "",
    "raw": "Next one",
    "verbatim": false,
    "expected_text": " Next one",
    "expected_changes": [
      { "kind": "leading_space", "detail": "previous character '.' is not whitespace or an opening bracket/quote" }
    ]
  },
  {
    "schema_version": 1,
    "case_id": "after-period-space-present",
    "description": "sentence end with the space already there: nothing to do",
    "before": "Done. ",
    "after": "",
    "raw": "Next one",
    "verbatim": false,
    "expected_text": "Next one",
    "expected_changes": []
  },
  {
    "schema_version": 1,
    "case_id": "after-question-exclamation",
    "description": "mixed ?! keeps the capital, space still added",
    "before": "Really?!",
    "after": "",
    "raw": "Next",
    "verbatim": false,
    "expected_text": " Next",
    "expected_changes": [
      { "kind": "leading_space", "detail": "previous character '!' is not whitespace or an opening bracket/quote" }
    ]
  },
  {
    "schema_version": 1,
    "case_id": "after-comma-lowercase",
    "description": "comma continues the sentence",
    "before": "First,",
    "after": "",
    "raw": "Second",
    "verbatim": false,
    "expected_text": " second",
    "expected_changes": [
      { "kind": "leading_space", "detail": "previous character ',' is not whitespace or an opening bracket/quote" },
      { "kind": "first_letter_case", "detail": "previous non-whitespace ',' continues the sentence" }
    ]
  },
  {
    "schema_version": 1,
    "case_id": "after-semicolon",
    "description": "semicolon continues the sentence",
    "before": "a;",
    "after": "",
    "raw": "B",
    "verbatim": false,
    "expected_text": " b",
    "expected_changes": [
      { "kind": "leading_space", "detail": "previous character ';' is not whitespace or an opening bracket/quote" },
      { "kind": "first_letter_case", "detail": "previous non-whitespace ';' continues the sentence" }
    ]
  },
  {
    "schema_version": 1,
    "case_id": "after-colon",
    "description": "colon continues the sentence",
    "before": "Note:",
    "after": "",
    "raw": "This",
    "verbatim": false,
    "expected_text": " this",
    "expected_changes": [
      { "kind": "leading_space", "detail": "previous character ':' is not whitespace or an opening bracket/quote" },
      { "kind": "first_letter_case", "detail": "previous non-whitespace ':' continues the sentence" }
    ]
  },
  {
    "schema_version": 1,
    "case_id": "after-newline",
    "description": "a newline boundary behaves like the start of a field",
    "before": "line one\n",
    "after": "",
    "raw": "Second line",
    "verbatim": false,
    "expected_text": "Second line",
    "expected_changes": []
  },
  {
    "schema_version": 1,
    "case_id": "after-newline-indented",
    "description": "newline plus indentation still behaves like a field start (list item)",
    "before": "item one\n- ",
    "after": "",
    "raw": "Second item",
    "verbatim": false,
    "expected_text": "Second item",
    "expected_changes": []
  },
  {
    "schema_version": 1,
    "case_id": "after-opening-paren",
    "description": "opening parenthesis: quoted-content start, no space, case kept",
    "before": "(",
    "after": ")",
    "raw": "see note",
    "verbatim": false,
    "expected_text": "see note",
    "expected_changes": []
  },
  {
    "schema_version": 1,
    "case_id": "after-opening-bracket",
    "description": "opening bracket: content start",
    "before": "[",
    "after": "]",
    "raw": "first",
    "verbatim": false,
    "expected_text": "first",
    "expected_changes": []
  },
  {
    "schema_version": 1,
    "case_id": "after-opening-straight-quote",
    "description": "straight double quote counts as opening at the insertion point",
    "before": "He said \"",
    "after": "\"",
    "raw": "hello",
    "verbatim": false,
    "expected_text": "hello",
    "expected_changes": []
  },
  {
    "schema_version": 1,
    "case_id": "after-opening-typographic-quote",
    "description": "typographic opening quote: content start",
    "before": "Er sagte „",
    "after": "“",
    "raw": "hallo",
    "verbatim": false,
    "expected_text": "hallo",
    "expected_changes": []
  },
  {
    "schema_version": 1,
    "case_id": "after-opening-guillemet",
    "description": "opening guillemet: content start",
    "before": "Il dit «",
    "after": "»",
    "raw": "Bonjour",
    "verbatim": false,
    "expected_text": "Bonjour",
    "expected_changes": []
  },
  {
    "schema_version": 1,
    "case_id": "after-closing-quote-continues",
    "description": "typographic closing quote continues the sentence",
    "before": "said “hi”",
    "after": "",
    "raw": "And",
    "verbatim": false,
    "expected_text": " and",
    "expected_changes": [
      { "kind": "leading_space", "detail": "previous character '”' is not whitespace or an opening bracket/quote" },
      { "kind": "first_letter_case", "detail": "previous non-whitespace '”' continues the sentence" }
    ]
  },
  {
    "schema_version": 1,
    "case_id": "after-closing-paren-continues",
    "description": "closing parenthesis continues the sentence",
    "before": "(see this)",
    "after": "",
    "raw": "Now",
    "verbatim": false,
    "expected_text": " now",
    "expected_changes": [
      { "kind": "leading_space", "detail": "previous character ')' is not whitespace or an opening bracket/quote" },
      { "kind": "first_letter_case", "detail": "previous non-whitespace ')' continues the sentence" }
    ]
  },
  {
    "schema_version": 1,
    "case_id": "before-existing-punct-no-trailing",
    "description": "punctuation right after the cursor never gets a trailing space",
    "before": "Note",
    "after": ", please",
    "raw": "this",
    "verbatim": false,
    "expected_text": " this",
    "expected_changes": [
      { "kind": "leading_space", "detail": "previous character 'e' is not whitespace or an opening bracket/quote" }
    ]
  },
  {
    "schema_version": 1,
    "case_id": "before-existing-period-raw-keeps-its-end",
    "description": "a period after the cursor: the dictated text's own period stays (no trailing change)",
    "before": "Hello",
    "after": ".",
    "raw": "World.",
    "verbatim": false,
    "expected_text": " world.",
    "expected_changes": [
      { "kind": "leading_space", "detail": "previous character 'o' is not whitespace or an opening bracket/quote" },
      { "kind": "first_letter_case", "detail": "previous non-whitespace 'o' continues the sentence" }
    ]
  },
  {
    "schema_version": 1,
    "case_id": "after-mid-word-no-trailing-space",
    "description": "cursor inside a word after the insertion point: no trailing change",
    "before": "The quick",
    "after": "ing fox",
    "raw": "brown",
    "verbatim": false,
    "expected_text": " brown",
    "expected_changes": [
      { "kind": "leading_space", "detail": "previous character 'k' is not whitespace or an opening bracket/quote" }
    ]
  },
  {
    "schema_version": 1,
    "case_id": "raw-starts-with-whitespace",
    "description": "dictated text already starting with a space is not double-spaced, case rule still applies",
    "before": "word",